{
  "schema_version": "lathe.world_memory.v1",
  "memory_id": "worldmem_abandoned_roblox_mall",
  "scene_id": "abandoned_roblox_mall",
  "scene_version": 1,
  "current_branch": "main",
  "summary": "Continuity memory for the abandoned_roblox_mall Wonder golden fixture.",
  "branches": [
    {
      "branch_id": "main",
      "name": "Main continuity",
      "status": "active",
      "event_ids": []
    }
  ],
  "events": []
}
